{
  "schemaVersion": 1,
  "package": "pi-sdlc",
  "sources": [
    {
      "id": "inventory.self",
      "source": "skills/sdlc/assets/normative-references.json",
      "assertion": "\"schemaVersion\": 1",
      "targetKind": "file",
      "ownership": "package",
      "required": true,
      "resolution": "package",
      "target": "skills/sdlc/assets/normative-references.json",
      "class": "internal"
    },
    {
      "id": "inventory.schema",
      "source": "skills/sdlc/assets/normative-references.json",
      "assertion": "\"target\": \"skills/sdlc/assets/normative-references.schema.json\"",
      "targetKind": "file",
      "ownership": "package",
      "required": true,
      "resolution": "package",
      "target": "skills/sdlc/assets/normative-references.schema.json",
      "class": "internal"
    },
    {
      "id": "checker.source",
      "source": "skills/sdlc/scripts/check-references.mjs",
      "assertion": "NORMATIVE-REFERENCE-CHECKER: FS11-v1",
      "targetKind": "command",
      "ownership": "package",
      "required": true,
      "resolution": "package",
      "target": "skills/sdlc/scripts/check-references.mjs",
      "class": "internal"
    },
    {
      "id": "checker.wrapper",
      "source": "skills/sdlc/scripts/check-references.sh",
      "assertion": "NORMATIVE-REFERENCE-WRAPPER: FS11-v1",
      "targetKind": "command",
      "ownership": "package",
      "required": true,
      "resolution": "package",
      "target": "skills/sdlc/scripts/check-references.sh",
      "class": "package-public"
    },
    {
      "id": "skill.source",
      "source": "skills/sdlc/SKILL.md",
      "assertion": "# sdlc",
      "targetKind": "file",
      "ownership": "package",
      "required": true,
      "resolution": "package",
      "target": "skills/sdlc/SKILL.md",
      "class": "package-public"
    },
    {
      "id": "skill.lifecycle-checker",
      "source": "skills/sdlc/references/phase-pr-review.md",
      "assertion": "The `check-lifecycle` script verifies the declared",
      "targetKind": "command",
      "ownership": "package",
      "required": true,
      "resolution": "package",
      "target": "skills/sdlc/scripts/check-lifecycle.mjs",
      "class": "package-public"
    },
    {
      "id": "skill.pr-template",
      "source": "skills/sdlc/SKILL.md",
      "assertion": "template's `sdlc` declaration block",
      "targetKind": "file",
      "ownership": "package",
      "required": true,
      "resolution": "package",
      "target": "skills/sdlc/assets/pull_request_template.md",
      "class": "package-public"
    },
    {
      "id": "skill.ci-workflow",
      "source": "README.md",
      "assertion": "setup offers a pinned pi-sdlc workflow only when no CI configuration is detected",
      "targetKind": "file",
      "ownership": "package",
      "required": true,
      "resolution": "package",
      "target": "skills/sdlc/assets/sdlc-lifecycle.yml",
      "class": "consumer-integration"
    },
    {
      "id": "consumer.panels",
      "source": "skills/sdlc/SKILL.md",
      "assertion": "its merged `panels`",
      "targetKind": "file",
      "ownership": "consumer",
      "required": true,
      "resolution": "readiness",
      "target": ".pi/sdlc/sdlc.config.json",
      "verification": {
        "source": "skills/sdlc/scripts/sdlc-status.mjs",
        "assertion": "set(\"config.panels\", \"pass\", \"panels roster present\");"
      },
      "class": "consumer-integration"
    },
    {
      "id": "readme.source",
      "source": "README.md",
      "assertion": "# pi-sdlc",
      "targetKind": "file",
      "ownership": "package",
      "required": true,
      "resolution": "package",
      "target": "README.md",
      "class": "package-public"
    },
    {
      "id": "setup-template.source",
      "source": "templates/setup-sdlc.md",
      "assertion": "This template can run before the `sdlc` skill has ever been loaded in this",
      "targetKind": "file",
      "ownership": "package",
      "required": true,
      "resolution": "package",
      "target": "templates/setup-sdlc.md",
      "class": "package-public"
    },
    {
      "id": "tracker.asset",
      "source": "skills/sdlc/assets/tracker-ops.md",
      "assertion": "# Tracker operations (GitHub)",
      "targetKind": "file",
      "ownership": "package",
      "required": true,
      "resolution": "package",
      "target": "skills/sdlc/assets/tracker-ops.md",
      "class": "package-public"
    },
    {
      "id": "script.tracker-ops",
      "source": "skills/sdlc/scripts/tracker-ops.mjs",
      "assertion": "tracker-ops.mjs — scripted wrapper for the GitHub tracker mutations",
      "targetKind": "file",
      "ownership": "package",
      "required": true,
      "resolution": "package",
      "target": "skills/sdlc/scripts/tracker-ops.mjs",
      "class": "internal"
    },
    {
      "id": "script.tracker-ops-wrapper",
      "source": "skills/sdlc/scripts/tracker-ops.sh",
      "assertion": "tracker-ops.sh — thin entry point for the sdlc tracker-ops helper.",
      "targetKind": "command",
      "ownership": "package",
      "required": true,
      "resolution": "package",
      "target": "skills/sdlc/scripts/tracker-ops.sh",
      "class": "package-public"
    },
    {
      "id": "agent-brief.asset",
      "source": "skills/sdlc/assets/agent-brief.md",
      "assertion": "# Writing durable issue/ticket bodies",
      "targetKind": "file",
      "ownership": "package",
      "required": true,
      "resolution": "package",
      "target": "skills/sdlc/assets/agent-brief.md",
      "class": "package-public"
    },
    {
      "id": "prompt.plan",
      "source": "skills/sdlc/prompts/adversary-plan.prompt.md",
      "assertion": "You are REVIEWER_TAG, a ruthless adversarial reviewer of a feature PLAN",
      "targetKind": "file",
      "ownership": "package",
      "required": true,
      "resolution": "package",
      "target": "skills/sdlc/prompts/adversary-plan.prompt.md",
      "class": "package-public"
    },
    {
      "id": "prompt.validator",
      "source": "skills/sdlc/prompts/validator-task.prompt.md",
      "assertion": "You are REVIEWER_TAG, a mechanistic task validator.",
      "targetKind": "file",
      "ownership": "package",
      "required": true,
      "resolution": "package",
      "target": "skills/sdlc/prompts/validator-task.prompt.md",
      "class": "package-public"
    },
    {
      "id": "prompt.spec",
      "source": "skills/sdlc/prompts/adversary-spec.prompt.md",
      "assertion": "You are REVIEWER_TAG, a ruthless adversarial reviewer of a feature SPEC",
      "targetKind": "file",
      "ownership": "package",
      "required": true,
      "resolution": "package",
      "target": "skills/sdlc/prompts/adversary-spec.prompt.md",
      "class": "package-public"
    },
    {
      "id": "prompt.review",
      "source": "skills/sdlc/prompts/adversary-review.prompt.md",
      "assertion": "You are REVIEWER_TAG, a ruthless adversarial code reviewer.",
      "targetKind": "file",
      "ownership": "package",
      "required": true,
      "resolution": "package",
      "target": "skills/sdlc/prompts/adversary-review.prompt.md",
      "class": "package-public"
    },
    {
      "id": "script.status",
      "source": "skills/sdlc/scripts/sdlc-status.sh",
      "assertion": "sdlc-status.sh \u2014 thin entry point for the FS8 four-state readiness gate.",
      "targetKind": "command",
      "ownership": "package",
      "required": true,
      "resolution": "package",
      "target": "skills/sdlc/scripts/sdlc-status.sh",
      "class": "package-public"
    },
    {
      "id": "script.panel-resolver",
      "source": "skills/sdlc/scripts/resolve-panel.sh",
      "assertion": "resolve-panel.sh \u2014 thin entry point for the sdlc panel resolver.",
      "targetKind": "command",
      "ownership": "package",
      "required": true,
      "resolution": "package",
      "target": "skills/sdlc/scripts/resolve-panel.sh",
      "class": "package-public"
    },
    {
      "id": "script.panel-agent",
      "source": "skills/sdlc/scripts/ensure-panel-agent.sh",
      "assertion": "ensure-panel-agent.sh \u2014 thin entry point for the sdlc panel-agent stamper.",
      "targetKind": "command",
      "ownership": "package",
      "required": true,
      "resolution": "package",
      "target": "skills/sdlc/scripts/ensure-panel-agent.sh",
      "class": "package-public"
    },
    {
      "id": "script.validator",
      "source": "skills/sdlc/scripts/validate-task.sh",
      "assertion": "validate-task.sh \u2014 thin entry point for the deterministic per-task validation",
      "targetKind": "command",
      "ownership": "package",
      "required": true,
      "resolution": "package",
      "target": "skills/sdlc/scripts/validate-task.sh",
      "class": "package-public"
    },
    {
      "id": "script.receipt-verifier",
      "source": "skills/sdlc/scripts/verify-task-receipt.mjs",
      "assertion": "verify-task-receipt.mjs \u2014 verify a stored portable-validator runtime receipt.",
      "targetKind": "command",
      "ownership": "package",
      "required": true,
      "resolution": "package",
      "target": "skills/sdlc/scripts/verify-task-receipt.mjs",
      "class": "internal"
    },
    {
      "id": "schema.task-validation",
      "source": "skills/sdlc/schema/task-validation-manifest.schema.json",
      "assertion": "\"title\": \"task-validation-manifest\"",
      "targetKind": "file",
      "ownership": "package",
      "required": true,
      "resolution": "package",
      "target": "skills/sdlc/schema/task-validation-manifest.schema.json",
      "class": "package-public"
    },
    {
      "id": "consumer.workflow",
      "source": "skills/sdlc/references/system-reference.md",
      "assertion": "An optional `.pi/sdlc/workflow.md`",
      "targetKind": "file",
      "ownership": "consumer",
      "required": false,
      "resolution": "consumer",